CpGmarker,CoefficientTraining,CoefficientTrainingShrunk,varByCpG,minByCpG,maxByCpG,medianByCpG,medianByCpGYoung,medianByCpGOld,Gene_ID,GenomeBuild,Chr,MapInfo,SourceVersion,TSS_Coordinate,Gene_Strand,Symbol,Synonym,Accession,GID,Annotation,Product,Marginal Age Relationship
cg11388238,-0.475300518,-0.475300518,0.0018,0.016,0.63,0.056,0.068,0.05,130535,36,2,201083343,36.1,201083037,-,KCTD18,FLJ31322; FLJ37818; 6530404F10Rik; ,NM_152387.2,GI:45387952,go_component: membrane; go_component: voltage-gated potassium channel complex; go_function: voltage-gated potassium channel activity; go_process: potassium ion transport,potassium channel tetramerisation domain containing 18,negative
cg12413566,-0.215453029,-0.215453029,0.012,0.011,0.99,0.9,0.9,0.89,165904,36,3,39210370,36.1,39209081,-,CMYA1,Xin; DKFZp451D042; DKFZp779C1947; ,NM_194293.2,GI:40255271,synonyms: Xin; DKFZp451D042; DKFZp779C1947,cardiomyopathy associated 1,negative
cg13129046,-0.030879589,-0.030879589,0.01,0.023,0.84,0.15,0.19,0.14,219738,36,10,71059702,36.1,71060020,+,C10orf35,,NM_145306.1,GI:21687152,go_component: membrane; go_component: integral to membrane,hypothetical protein LOC219738,negative
cg13269407,-0.038113525,-0.038113525,0.014,0.013,0.84,0.1,0.15,0.095,55267,36,22,44828771,36.1,44828688,-,FLJ10945,,NM_018280.1,GI:8922784,,hypothetical protein LOC55267,negative
cg13547237,-0.382640829,-0.382640829,0.01,0.00016,0.89,0.26,0.28,0.25,83638,36,11,65444453,36.1,65443107,-,Bles03,P5326; ,NM_031450.2,GI:31543378,synonym: P5326,basophilic leukemia expressed protein BLES03,negative
cg13828047,-0.158465037,-0.158465037,0.013,0.016,0.92,0.31,0.32,0.3,4351,36,15,72969183,36.1,72969463,+,MPI,PMI; PMI1; ,NM_002435.1,GI:4505234,###############################################################################################################################################################################################################################################################,mannose-6- phosphate isomerase,negative
cg13931228,-0.360016319,-0.360016319,0.0016,0,0.57,0.057,0.067,0.05,51678,36,7,24578943,36.1,24579610,+,MPP6,VAM1; p55T; PALS2; VAM-1; ,NM_016447.2,GI:21361597,MAGUK protein p55T; protein associated with Lin7 2; VELI-associated MAGUK 1; go_component: membrane; go_function: protein binding; go_process: protein complex assembly,membrane protein; palmitoylated 6,negative
cg14654875,-0.036208905,-0.036208905,0.0057,0.015,0.89,0.43,0.44,0.43,146434,36,16,3433998,36.1,3433491,-,ZNF597,FLJ33071; ,NM_152457.1,GI:22748966,go_component: nucleus; go_function: DNA binding; go_function: zinc ion binding; go_function: metal ion binding; go_process: transcription; go_process: regulation of transcription; DNA-dependent,zinc finger protein 597,negative
cg16744741,-0.497488212,-0.497488212,0.052,0.053,0.96,0.52,0.64,0.38,5593,36,4,82345049,36.1,82345239,-,PRKG2,cGKII; PRKGR2; ,NM_006259.1,GI:5453977,###############################################################################################################################################################################################################################################################,protein kinase; cGMP-dependent; type II,negative
cg17324128,-0.851186251,-0.851186251,0.0065,0.0097,0.83,0.14,0.18,0.12,83937,36,10,44775506,36.1,44775225,+,RASSF4,AD037; MGC44914; ,NM_032023.3,GI:30474868,isoform a is encoded by transcript variant 1; tumor suppressor RASSF4; go_function: protein binding; go_function: oxidoreductase activity; go_process: signal transduction,Ras association domain family 4 isoform a,negative
cg17338403,-0.009380072,-0.009380072,0.0075,0.0042,0.99,0.11,0.1,0.11,28232,36,15,90196840,36.1,90197950,+,SLCO3A1,OATP-D; OATP3A1; SLC21A11; ,NM_013272.2,GI:7706713,solute carrier family 21 (organic anion transporter); member 11; go_component: membrane; go_component: integral to membrane; go_function: transporter activity; go_process: ion transport,solute carrier organic anion transporter family; member 3A1,negative
cg18328933,-0.177608179,-0.177608179,0.02,0.021,0.96,0.63,0.65,0.61,25864,36,3,51983578,36.1,51984124,+,ABHD14A,DORZ1; DKFZP564O243; ,NM_015407.3,GI:34147328,go_function: hydrolase activity; go_process: aromatic compound metabolism,abhydrolase domain containing 14A,negative
cg19722847,-0.672425548,-0.672425548,0.0083,0.017,0.68,0.12,0.16,0.1,10526,36,12,30740381,36.1,30740018,-,IPO8,RANBP8; ,NM_006390.2,GI:53759102,###############################################################################################################################################################################################################################################################,importin 8,negative
cg19724470,-0.146940496,-0.146940496,0.015,0,0.86,0.2,0.26,0.16,29126,36,9,5440936,36.1,5440559,+,CD274,B7-H; B7H1; PDL1; PD-L1; PDCD1L1; PDCD1LG1; ,NM_014143.2,GI:20070268,programmed cell death 1 ligand 1; go_component: membrane; go_component: integral to membrane; go_function: receptor activity; go_process: immune response; go_process: cell proliferation; go_process: cell surface receptor linked signal transduction,CD274 antigen,negative
cg19761273,-0.93416923,-0.93416923,0.011,0.026,0.97,0.19,0.26,0.16,1453,36,17,77825385,36.1,77824862,-,CSNK1D,HCKID; ,NM_001893.3,GI:20544143,###############################################################################################################################################################################################################################################################,casein kinase 1; delta isoform 1,negative
cg19853760,-0.072551939,-0.072551939,0.031,0.018,0.98,0.5,0.61,0.46,3956,36,22,36401623,36.1,36401589,+,LGALS1,GBP; ,NM_002305.2,GI:6006015,galectin; Lectin; galactose-binding; soluble; 1; go_component: cytoplasm; go_function: sugar binding; go_function: signal transducer activity; go_process: regulation of apoptosis; go_process: positive regulation of I-kappaB kinase/NF-kappaB cascade,beta-galactoside-binding lectin precursor,negative
cg22171829,-0.013845279,-0.013845279,0.019,0,0.83,0.25,0.32,0.23,5166,36,7,95063456,36.1,95063739,-,PDK4,,NM_002612.2,GI:33589822,go_component: mitochondrion; go_function: ATP binding; go_function: [pyruvate dehydrogenase (lipoamide)] kinase activity; go_process: glucose metabolism; go_process: protein amino acid phosphorylation,pyruvate dehydrogenase kinase; isoenzyme 4,negative
cg22197830,-0.17248215,-0.17248215,0.026,0.033,0.95,0.68,0.76,0.65,79770,36,5,134237683,36.1,134237326,+,C5orf14,UNQ335; FLJ22625; ,NM_024715.2,GI:21362011,2310047H23Rik; go_function: isomerase activity; go_function: electron transporter activity; go_process: electron transport,disulfide isomerase,negative
cg24058132,-0.077071346,-0.077071346,0.022,0.0012,0.97,0.46,0.53,0.4,2581,36,14,87529619,36.1,87529596,-,GALC,,NM_000153.1,GI:4557612,galactocerebrosidase; Galactosylceraminidase; go_component: lysosome; go_function: galactosylceramidase activity; go_function: hydrolase activity; acting on glycosyl bonds; go_process: carbohydrate metabolism; go_process: galactosylceramide catabolism,galactosylceramidase precursor,negative
cg24899750,-0.256103442,-0.256103442,0.011,0.033,0.97,0.58,0.61,0.56,6629,36,20,16658314,36.1,16658629,+,SNRPB2,MGC24807; MGC45309; ,NM_003092.3,GI:38149917,###############################################################################################################################################################################################################################################################,small nuclear ribonucleoprotein polypeptide B,negative
cg25809905,-0.348900512,-0.348900512,0.02,0.0019,0.96,0.69,0.77,0.61,3674,36,17,39823254,36.1,39822399,-,ITGA2B,GTA; CD41; GP2B; HPA3; CD41B; GPIIb; ,NM_000419.2,GI:6006009,###############################################################################################################################################################################################################################################################,integrin alpha 2b precursor,negative
cg26394940,-0.344126844,-0.344126844,0.021,0,0.91,0.076,0.11,0.064,55267,36,22,44828125,36.1,44828688,-,FLJ10945,,NM_018280.1,GI:8922784,,hypothetical protein LOC55267,negative
cg27015931,-0.764866217,-0.764866217,0.0027,0.022,0.61,0.092,0.11,0.09,255762,36,16,21919905,36.1,21919929,-,MGC50721,,NM_173806.2,GI:31341127,go_function: protein binding,hypothetical protein LOC255762,negative
cg27202708,-0.104235908,-0.104235908,0.014,0.0095,0.84,0.29,0.29,0.3,164127,36,1,221633332,36.1,221633391,+,C1orf65,FLJ35728; RP11-76K24.1; ,NM_152610.1,GI:22749248,synonyms: FLJ35728; RP11-76K24.1,hypothetical protein LOC164127,negative
cg27544190,-1.230694818,-1.230694818,0.003,0.0088,0.6,0.088,0.1,0.086,59271,36,21,32707305,36.1,32706623,+,C21orf63,B18; SUE21; PRED34; ,NM_058187.3,GI:38372914,go_component: integral to membrane; go_function: sugar binding,chromosome 21 open reading frame 63,negative
